PK;NOMBRE;DESCRIPCION-ENTIDAD;HORARIO;EQUIPAMIENTO;TRANSPORTE;DESCRIPCION;ACCESIBILIDAD;CONTENT-URL;NOMBRE-VIA;CLASE-VIAL;TIPO-NUM;NUM;PLANTA;PUERTA;ESCALERAS;ORIENTACION;LOCALIDAD;PROVINCIA;CODIGO-POSTAL;COD-BARRIO;BARRIO;COD-DISTRITO;DISTRITO;COORDENADA-X;COORDENADA-Y;LATITUD;LONGITUD;TELEFONO;FAX;EMAIL;TIPO
12424;Mercado municipal de Alto de Extremadura;"En el Mercado de Alto de Extremadura cualquier ocasión es buena para acercarse (y acercar) a los vecinos: un partido de fútbol o el día del patrón, la inminencia del año nuevo o la celebración de un aniversario. La vida se renueva cada día en este mercado, abierto al público en 1974 y renovado en 2011, que combina la oferta tradicional de productos frescos, variantes y ultramarinos en puestos especializados con el servicio de un supermercado de medianas dimensiones. La veteranía y la confianza -comercio de cercanía- son aquí una constante, que cristaliza durante los fines de semana en degustaciones de platos de auténtica cocina de mercado: paella de campo o callos a la madrileña. Ubicado en el Paseo de los Jesuitas -muchos lo conocen todavía como &amp;ldquo;el mercado de los Jesuitas&amp;rdquo;- su área de influencia desborda los límites del barrio de Puerta del Ángel y se extiende a lo largo del Paseo de Extremadura. Este mercado abrió sus puertas por vez primera en junio de 1974 y tras 37 años de actividad se reinaugura en 2.011 para ofrecer a sus clientes la calidad, el servicio y el saber hacer de sus comercios típicos en un mercado tradicional, pero en un espacio renovado. Entre sus 26 puestos podrán encontrar distintos preparados y embutidos en carnes y pollos, chacinas regionales e ibéricas, frutas cortadas y en zumo, carnes exóticas, legumbres y encurtidos a granel directos del productor, productos extranjeros, carnes con denominación de orígen, podrá arreglar sus zapatos y duplicar sus llaves, todo ello tomándose un café en nuestra cafetería.";Invierno:  De lunes a viernes: de 9 a 14 y de 17 a 20:30 horas. Sábados: de 9 a 14 horas.    Verano:  De lunes a viernes: de 9 a 14 y de 17:30 a 20:30 horas. Sábados: de 9 a 14:30 horas.    Supermercado Carrefour Express:  De lunes a sábado: de 9:30 a 22 horas. Festivos: de 10 a 15 horas.;Dispone de wifi gratuita;Metro: Alto de Extremadura (línea 6)  Bus: 31, 33, 36, 39, 65, 119, 138;;1;http://www.madrid.es/sites/v/index.jsp?vgnextchannel=bfa48ab43d6bb410VgnVCM100000171f5a0aRCRD&vgnextoid=75e4e1635561c010VgnVCM1000000b205a0aRCRD;JESUITAS;PASEO;V;44;;;;;MADRID;MADRID;28011;2;PUERTA DEL ANGEL;10;LATINA;437622;4473300;4.040.797.174.906.470;-37.351.687.013.396.300;914 794 751;;info@mercadoaltoextremadura.es;/contenido/entidadesYorganismos/Comercios/Mercados
12418;Mercado municipal de Antón Martín;Del techo desciende el taconeo de la escuela de arte flamenco y del suelo ascienden los golpes de las carretillas que traen y llevan género. Entre una cosa y otra, se abre paso una amplia oferta de ocio y restauración que se complementa -dialoga- con los puestos del mercado tradicional: carnicerías y pollerías, verdulerías y fruterías y pescaderías que sirven fuera y dentro del mercado. El mercado de Antón Martín es un trasiego de gente que compra, de gente que se sienta a comer y de gente que se lo lleva a casa. Aunque el mercado, tal y como lo conocemos hoy, se abrió al público en 1941, hace más de trescientos años que se vende comida en la plaza de Antón Martín. Asomado a la calle Atocha, con un ojo puesto en el Barrio de las Letras y otro en Lavapiés, presenta una imagen en constante renovación -fachada intervenida por enormes grafitis- que se corresponde con lo que hay dentro: actividad permanente alrededor de la comida, ya sea un plato de ostras, media docena de croquetas de autor o kilo y medio de calabacines. Inaugurado en el año 1941, el mercado de Antón Martín, situado en el barrio de Embajadores, junto al Cine Doré, sede de la Filmoteca Española, cuenta con más de 80 locales, entre puestos interiores y tiendas exteriores.;Establecimientos del mercado tradicional:  de lunes a viernes de 9 a 21 horas y sábados de 9 a 15 horas.  Horario de restaruación: de lunes a viernes de 9 a 23:30 horas. Sábado de 15 a 18 horas (acceso por Duque de Fernán Núñez);Zona Wifi;Metro: Anton Martin (línea 1)  Bus: 6, 26, 32;;1;http://www.madrid.es/sites/v/index.jsp?vgnextchannel=bfa48ab43d6bb410VgnVCM100000171f5a0aRCRD&vgnextoid=cb05e1635561c010VgnVCM1000000b205a0aRCRD;SANTA ISABEL;CALLE;V;5;;;;;MADRID;MADRID;28012;2;EMBAJADORES;1;CENTRO;440710;4473658;40.411.422.452.721.500;-36.988.110.198.857.100;913 690 620;;mdoantonmartin@hotmail.com;/contenido/entidadesYorganismos/Comercios/Mercados
12426;Mercado municipal de Argüelles;"A medio camino entre la agitación de calle Princesa y la paz casi forestal del Parque del Oeste, en el cruce de Tutor con Altamirano, está el Mercado de Arg&amp;uuml;elles. Abrió sus puertas en 1949 y, en 2011, después de una exhaustiva remodelación, se convirtió en el mercado ordenado, racional, práctico y accesible que hoy conocemos. Perfectamente insertado en el trazado urbanístico del barrio, una cuadrícula de calles alargadas, combina una completa oferta en perecederos con un supermercado de medianas dimensiones y servicios como una costurera, tiendas de ropa y una academia musical. El mercado cuenta incluso con su propia controversia histórica, originada en torno a unos versos de Pablo Neruda: Todo eran grandes voces, sal de mercaderías, aglomeraciones de pan palpitante, mercados de mi barrio de Arg&amp;uuml;elles con su estatua como un tintero pálido entre las merluzas. Tanto si el poeta se refería a un mercado callejero desplegado en el solar sobre el que se edificó el actual como si no fue así, la cuestión es que ahora este es el mercado de Arg&amp;uuml;elles, con sus merluzas y su pan palpitante.";Mercado:  De lunes a viernes: de 9 a 14 y de 17:30 a 20 horas. Sábado: de 9 a 14 horas.    Supermercado Ahorramás: de lunes a sábado de 9 a 21 horas.;;"Metro: Arg&amp;uuml;elles (línea 3, 4 y 6). Salida calle Altamirano.  Bus: 1, 21, 44, 74, 82, 83, 132, 133, C, 21";;1;http://www.madrid.es/sites/v/index.jsp?vgnextchannel=bfa48ab43d6bb410VgnVCM100000171f5a0aRCRD&vgnextoid=1235e1635561c010VgnVCM1000000b205a0aRCRD;ALTAMIRANO;CALLE;V;7;;;;;MADRID;MADRID;28008;2;ARGUELLES;9;MONCLOA-ARAVACA;439107;4475866;40.431.197.427.341.100;-37.179.024.231.789.400;915 443 015;;;/contenido/entidadesYorganismos/Comercios/Mercados
12405;Mercado municipal de Bami;En el Barrio del Carmen, a dos manzanas de la calle Alcalá y entre una hilera de casas de cuatro pisos, está el mercado de Bami, construido en el año 1954. Su exterior luce un característico aspecto industrial, con cubierta en diente de sierra y muros de fábrica de ladrillo. En su interior encontramos, además de una completa oferta de alimentación (frutería, pescadería, carnicería, charcutería, obrador de panadería, y supermercado), un moderno ginmasio.;Invierno:  De lunes a viernes de 9 a 14 y de 17 a 20 horas. Sábados de 9 a 14 horas.    Verano (de abril a septiembre):  De lunes a viernes de 9 a 14 y de 17:30 a 20:30 horas. Sábados de 9 a 14 horas.;;Metro: Carmen (línea 5)  Bus: 38, 106, 110, 146, 210.;;1;http://www.madrid.es/sites/v/index.jsp?vgnextchannel=bfa48ab43d6bb410VgnVCM100000171f5a0aRCRD&vgnextoid=be75e1635561c010VgnVCM1000000b205a0aRCRD;BAMI;PLAZA;V;32;;;;;MADRID;MADRID;28017;1;VENTAS;15;CIUDAD LINEAL;444410;4475768;40.430.694.913.121.700;-3.655.377.903.084.200;914 013 839;;;/contenido/entidadesYorganismos/Comercios/Mercados
12393;Mercado municipal de Barceló;"El mercado de Barceló &amp;ndash;a un paso de Malasaña y en el corazón del Madrid más vibrante- suma y sigue. Más de diez mil metros cuadrados de puestos, repartidos en tres plantas, conforman este espacio, doblemente nuevo e integrado en el Centro Polivalente Barceló. Al antiguo edificio -1956- sucede un mercado que es nuevo por dentro y por fuera. La nueva edificación -inaugurada en 2014- ha venido acompañada de una idea nueva: hacer la compra puede o debe ser un placer. Los puestos de comercio tradicional conviven con nuevas iniciativas, que van desde una barbería a una tienda de productos de limpieza ecológicos. El de Barceló es un mercado elevado al cubo -fruta, carne y pescado- o un mercado de tres plantas -verdura, pollo y embutidos- dentro de un cubo gigante. Ahora, el mercado de Barceló dobla la apuesta con Food Gourmet, una isla de los placeres y los sentidos ubicada en la tercera planta y llamada a ser rompeolas del ocio gastronómico en el distrito Centro.";De lunes a viernes de 9 a 14:30 y de 17:30 a 20:30 horas. Sábados de 9 a 15 horas.;Dispone de wifi gratuita.;Metro: Tribunal (líneas 1, 10), Alonso Martínez (4, 5 y 10) y Bilbao (1 y 4)  Bus: 3, 21, 37, 40, 147, 149;;1;http://www.madrid.es/sites/v/index.jsp?vgnextchannel=bfa48ab43d6bb410VgnVCM100000171f5a0aRCRD&vgnextoid=05a5e1635561c010VgnVCM1000000b205a0aRCRD;BARCELO;CALLE;V;6;;;;;MADRID;MADRID;28004;4;JUSTICIA;1;CENTRO;440683;4475365;4.042.680.707.802.060;-36.992.767.323.438.300;914 475 550;;secretario@mercadobarcelo.es;/contenido/entidadesYorganismos/Comercios/Mercados
